{
  "schema_version": "0.1.0",
  "coordinate_space": "canvas_px",
  "canvas": {
    "width": 1024,
    "height": 1024
  },
  "parameters": [
    {
      "id": "EyeLeftBlink",
      "min": 0,
      "max": 1,
      "default": 0
    },
    {
      "id": "MouthOpen",
      "min": 0,
      "max": 1,
      "default": 0
    }
  ],
  "parts": [
    {
      "id": "base.body",
      "z_index": 0,
      "atlas_rect_px": [
        0,
        0,
        256,
        512
      ],
      "pivot_normalized": [
        0.5,
        0.5
      ],
      "vertices_px": [
        [
          0,
          0
        ],
        [
          256,
          0
        ],
        [
          256,
          512
        ],
        [
          0,
          512
        ]
      ],
      "uv": [
        [
          0,
          0
        ],
        [
          1,
          0
        ],
        [
          1,
          1
        ],
        [
          0,
          1
        ]
      ],
      "triangles": [
        [
          0,
          1,
          2
        ],
        [
          0,
          2,
          3
        ]
      ]
    },
    {
      "id": "face.mouth",
      "z_index": 5,
      "atlas_rect_px": [
        256,
        0,
        128,
        64
      ],
      "pivot_normalized": [
        0.5,
        0.5
      ],
      "vertices_px": [
        [
          0,
          0
        ],
        [
          128,
          0
        ],
        [
          128,
          64
        ],
        [
          0,
          64
        ]
      ],
      "uv": [
        [
          0,
          0
        ],
        [
          1,
          0
        ],
        [
          1,
          1
        ],
        [
          0,
          1
        ]
      ],
      "triangles": [
        [
          0,
          1,
          2
        ],
        [
          0,
          2,
          3
        ]
      ],
      "deform_targets": [
        {
          "parameter": "MouthOpen",
          "vertex_deltas_px": [
            [
              0,
              -2
            ],
            [
              0,
              -2
            ],
            [
              0,
              12
            ],
            [
              0,
              12
            ]
          ]
        }
      ]
    }
  ]
}
